{
  "$schema": "https://github.com/BagistoPlus/visual/blob/main/resources/schemas/section.schema.json",
  "name": "visual::sections.product-details.name",
  "description": "visual::sections.product-details.description",
  "max_blocks": 64,
  "blocks": [
    {
      "type": "text",
      "name": "visual::sections.product-details.blocks.text.name",
      "settings": [
        {
          "id": "position",
          "type": "select",
          "label": "visual::sections.product-details.settings.position_label",
          "default": "right",
          "options": [
            { "value": "right", "label": "visual::sections.product-details.settings.position_right"},
            { "value": "under_gallery", "label": "visual::sections.product-details.settings.position_under_gallery"}
          ]
        },
        {
          "id": "text",
          "type": "richtext",
          "label": "visual::sections.product-details.blocks.text.settings.text_label"
        }
      ]
    },
    {
      "type": "title",
      "name": "visual::sections.product-details.blocks.title.name",
      "limit": 1,
      "settings": [
        {
          "id": "position",
          "type": "select",
          "label": "visual::sections.product-details.settings.position_label",
          "default": "right",
          "options": [
            { "value": "right", "label": "visual::sections.product-details.settings.position_right"},
            { "value": "under_gallery", "label": "visual::sections.product-details.settings.position_under_gallery"}
          ]
        }
      ]
    },
    {
      "type": "price",
      "name": "visual::sections.product-details.blocks.price.name",
      "limit": 1,
      "settings": [
        {
          "id": "position",
          "type": "select",
          "label": "visual::sections.product-details.settings.position_label",
          "default": "right",
          "options": [
            { "value": "right", "label": "visual::sections.product-details.settings.position_right"},
            { "value": "under_gallery", "label": "visual::sections.product-details.settings.position_under_gallery"}
          ]
        }
      ]
    },
    {
      "type": "rating",
      "name": "visual::sections.product-details.blocks.rating.name",
      "limit": 1,
      "settings": [
        {
          "id": "position",
          "type": "select",
          "label": "visual::sections.product-details.settings.position_label",
          "default": "right",
          "options": [
            { "value": "right", "label": "visual::sections.product-details.settings.position_right"},
            { "value": "under_gallery", "label": "visual::sections.product-details.settings.position_under_gallery"}
          ]
        }
      ]
    },
    {
      "type": "short-description",
      "name": "visual::sections.product-details.blocks.short-description.name",
      "limit": 1,
      "settings": [
        {
          "id": "position",
          "type": "select",
          "label": "visual::sections.product-details.settings.position_label",
          "default": "right",
          "options": [
            { "value": "right", "label": "visual::sections.product-details.settings.position_right"},
            { "value": "under_gallery", "label": "visual::sections.product-details.settings.position_under_gallery"}
          ]
        }
      ]
    },
    {
      "type": "quantity-selector",
      "name": "visual::sections.product-details.blocks.quantity-selector.name",
      "limit": 1,
      "settings": [
        {
          "id": "position",
          "type": "select",
          "label": "visual::sections.product-details.settings.position_label",
          "default": "right",
          "options": [
            { "value": "right", "label": "visual::sections.product-details.settings.position_right"},
            { "value": "under_gallery", "label": "visual::sections.product-details.settings.position_under_gallery"}
          ]
        }
      ]
    },
    {
      "type": "buy-buttons",
      "name": "visual::sections.product-details.blocks.buy-buttons.name",
      "limit": 2,
      "settings": [
        {
          "id": "position",
          "type": "select",
          "label": "visual::sections.product-details.settings.position_label",
          "default": "right",
          "options": [
            { "value": "right", "label": "visual::sections.product-details.settings.position_right"},
            { "value": "under_gallery", "label": "visual::sections.product-details.settings.position_under_gallery"}
          ]
        },
        {
          "id": "enable_buy_now",
          "type": "checkbox",
          "label": "visual::sections.product-details.blocks.buy-buttons.settings.enable_buy_now_label",
          "info": "visual::sections.product-details.blocks.buy-buttons.settings.enable_buy_now_info"
        }
      ]
    },
    {
      "type": "description",
      "name": "visual::sections.product-details.blocks.description.name",
      "limit": 2,
      "settings": [
        {
          "id": "position",
          "type": "select",
          "label": "visual::sections.product-details.settings.position_label",
          "default": "right",
          "options": [
            { "value": "right", "label": "visual::sections.product-details.settings.position_right"},
            { "value": "under_gallery", "label": "visual::sections.product-details.settings.position_under_gallery"}
          ]
        }
      ]
    },
    {
      "type": "variant-picker",
      "name": "visual::sections.product-details.blocks.variant-picker.name",
      "limit": 1,
      "settings": [
        {
          "id": "position",
          "type": "select",
          "label": "visual::sections.product-details.settings.position_label",
          "default": "right",
          "options": [
            { "value": "right", "label": "visual::sections.product-details.settings.position_right"},
            { "value": "under_gallery", "label": "visual::sections.product-details.settings.position_under_gallery"}
          ]
        }
      ]
    },
    {
      "type": "grouped-options",
      "name": "visual::sections.product-details.blocks.grouped-options.name",
      "limit": 1,
      "settings": [
        {
          "id": "position",
          "type": "select",
          "label": "visual::sections.product-details.settings.position_label",
          "default": "right",
          "options": [
            { "value": "right", "label": "visual::sections.product-details.settings.position_right"},
            { "value": "under_gallery", "label": "visual::sections.product-details.settings.position_under_gallery"}
          ]
        }
      ]
    },
    {
      "type": "bundle-options",
      "name": "visual::sections.product-details.blocks.bundle-options.name",
      "limit": 1,
      "settings": [
        {
          "id": "position",
          "type": "select",
          "label": "visual::sections.product-details.settings.position_label",
          "default": "right",
          "options": [
            { "value": "right", "label": "visual::sections.product-details.settings.position_right"},
            { "value": "under_gallery", "label": "visual::sections.product-details.settings.position_under_gallery"}
          ]
        }
      ]
    },
    {
      "type": "separator",
      "name": "visual::sections.product-details.blocks.separator.name",
      "settings": [
        {
          "id": "position",
          "type": "select",
          "label": "visual::sections.product-details.settings.position_label",
          "default": "right",
          "options": [
            { "value": "right", "label": "visual::sections.product-details.settings.position_right"},
            { "value": "under_gallery", "label": "visual::sections.product-details.settings.position_under_gallery"}
          ]
        }
      ]
    }
  ],
  "default": {
    "blocks": [
      { "type": "title" },
      { "type": "price" },
      { "type": "rating" },
      { "type": "short-description" },
      { "type": "variant-picker" },
      { "type": "grouped-options" },
      { "type": "bundle-options" },
      { "type": "quantity-selector" },
      { "type": "buy-buttons" },
      { "type": "separator" },
      { "type": "description" }
    ]
  }
}
